{
  "artifact_schema_version": "2.0",
  "final_research_set": [
    {
      "rank": "1",
      "ticker": "MRNA",
      "company_name": "Moderna, Inc.",
      "sector": "Healthcare",
      "industry": "",
      "exchange": "NMS",
      "market_cap": "63410638848.00000000",
      "market_data_date": "2026-08-25",
      "price": "158.83000183",
      "return_1d": "0.14356687",
      "return_5d": "1.52271290",
      "return_21d": "1.85511413",
      "return_63d": "2.37720617",
      "return_126d": "2.14390341",
      "spy_return_63d": "0.02041054",
      "spy_return_126d": "0.11429403",
      "spy_relative_21d": "1.81882633",
      "spy_relative_63d": "2.35679563",
      "spy_relative_126d": "2.02960938",
      "sector_etf": "XLV",
      "sector_etf_return_21d": "0.07276622",
      "sector_etf_return_63d": "0.18032456",
      "sector_etf_return_126d": "0.11034395",
      "sector_relative_21d": "1.78234791",
      "sector_relative_63d": "2.19688161",
      "sector_relative_126d": "2.03355947",
      "volume_ratio_5d_vs_prev20d": "17.38575678",
      "avg_dollar_volume_20d": "3891272098.25457239",
      "volatility_ratio_20d_vs_prev120d": "9.24864431",
      "max_daily_move_21d": "1.76969516",
      "max_daily_move_date_21d": "2026-08-19",
      "max_daily_move_signed_21d": "1.76969516",
      "max_1d_share_of_abs_move_21d": "0.64624953",
      "directional_efficiency_21d": "0.52382922",
      "post_max_move_return_5d": "",
      "post_max_move_return_10d": "",
      "max_gap_21d": "0.84275728",
      "distance_from_52w_high": "-0.08917309",
      "distance_from_52w_low": "6.10330937",
      "trigger_conditions": "spy_relative;sector_relative;volume;volatility;single_day_move;gap",
      "trigger_count": "6",
      "selection_reason": "threshold_and_sector_coverage",
      "signal_score": "98.15990000",
      "first_trigger_date": "2026-07-10",
      "trigger_days_last_5": "5",
      "trigger_days_last_10": "5",
      "consecutive_trigger_days": "5",
      "rank_previous": "1.00000000",
      "rank_change": "0.00000000",
      "new_entry": "True",
      "persistent_signal": "True",
      "entity_id": "ent_ffba8cd65fadbeb0a6ddb2b346eb9fe4d8846c2e5f5d27d765a1523a1656b04a",
      "route_candidate_id": "route_12b757c8babd4cda0c1b3b13c5d755e269a58d7bb8e143abfb3503ac02be9ade",
      "source_dataset": "event_anomaly",
      "original_rank": 1,
      "entry_price_status": "pending",
      "entry_price": null,
      "first_tradable_at": "2026-08-26T13:30:00+00:00",
      "entry_price_timestamp": null,
      "entry_price_type": "next_session_open",
      "timezone": "America/New_York",
      "quantitative_processing_status": "processed",
      "treatment": "web_research",
      "treatment_reason": "deterministic cross-route research selection",
      "data_quality_status": "passed"
    },
    {
      "rank": "2",
      "ticker": "REPL",
      "company_name": "Replimune Group, Inc.",
      "sector": "Healthcare",
      "industry": "",
      "exchange": "NMS",
      "market_cap": "1488670208.00000000",
      "market_data_date": "2026-08-25",
      "price": "15.80000019",
      "return_1d": "0.07409926",
      "return_5d": "0.01412068",
      "return_21d": "0.83082271",
      "return_63d": "2.43478272",
      "return_126d": "0.88995225",
      "spy_return_63d": "0.02041054",
      "spy_return_126d": "0.11429403",
      "spy_relative_21d": "0.79453492",
      "spy_relative_63d": "2.41437218",
      "spy_relative_126d": "0.77565823",
      "sector_etf": "XLV",
      "sector_etf_return_21d": "0.07276622",
      "sector_etf_return_63d": "0.18032456",
      "sector_etf_return_126d": "0.11034395",
      "sector_relative_21d": "0.75805649",
      "sector_relative_63d": "2.25445817",
      "sector_relative_126d": "0.77960831",
      "volume_ratio_5d_vs_prev20d": "0.39927602",
      "avg_dollar_volume_20d": "81187870.13518576",
      "volatility_ratio_20d_vs_prev120d": "1.81105978",
      "max_daily_move_21d": "1.07024032",
      "max_daily_move_date_21d": "2026-07-31",
      "max_daily_move_signed_21d": "1.07024032",
      "max_1d_share_of_abs_move_21d": "0.47155754",
      "directional_efficiency_21d": "0.30175300",
      "post_max_move_return_5d": "0.07678577",
      "post_max_move_return_10d": "0.33660719",
      "max_gap_21d": "1.10332718",
      "distance_from_52w_high": "0.00000000",
      "distance_from_52w_low": "8.29411750",
      "trigger_conditions": "spy_relative;sector_relative;volatility;single_day_move;gap",
      "trigger_count": "5",
      "selection_reason": "threshold",
      "signal_score": "51.66570000",
      "first_trigger_date": "2026-08-04",
      "trigger_days_last_5": "5",
      "trigger_days_last_10": "10",
      "consecutive_trigger_days": "15",
      "rank_previous": "3.00000000",
      "rank_change": "1.00000000",
      "new_entry": "True",
      "persistent_signal": "True",
      "entity_id": "ent_81ff57469dd97223513b2e11f6aa407fc0300742331e1594824d11a6cd4564aa",
      "route_candidate_id": "route_5899258f206dbc5cdc8f542c6574b68e47d0ab6f5e7b74b70b082b850d434b22",
      "source_dataset": "event_anomaly",
      "original_rank": 2,
      "entry_price_status": "pending",
      "entry_price": null,
      "first_tradable_at": "2026-08-26T13:30:00+00:00",
      "entry_price_timestamp": null,
      "entry_price_type": "next_session_open",
      "timezone": "America/New_York",
      "quantitative_processing_status": "processed",
      "treatment": "web_research",
      "treatment_reason": "deterministic cross-route research selection",
      "data_quality_status": "passed"
    },
    {
      "rank": "3",
      "ticker": "ABCL",
      "company_name": "AbCellera Biologics Inc.",
      "sector": "Healthcare",
      "industry": "",
      "exchange": "NMS",
      "market_cap": "4050592000.00000000",
      "market_data_date": "2026-08-25",
      "price": "12.50000000",
      "return_1d": "0.17813387",
      "return_5d": "0.12410073",
      "return_21d": "1.38095238",
      "return_63d": "1.36294898",
      "return_126d": "2.88198754",
      "spy_return_63d": "0.02041054",
      "spy_return_126d": "0.11429403",
      "spy_relative_21d": "1.34466459",
      "spy_relative_63d": "1.34253844",
      "spy_relative_126d": "2.76769351",
      "sector_etf": "XLV",
      "sector_etf_return_21d": "0.07276622",
      "sector_etf_return_63d": "0.18032456",
      "sector_etf_return_126d": "0.11034395",
      "sector_relative_21d": "1.30818616",
      "sector_relative_63d": "1.18262442",
      "sector_relative_126d": "2.77164360",
      "volume_ratio_5d_vs_prev20d": "0.80515670",
      "avg_dollar_volume_20d": "100948911.80721760",
      "volatility_ratio_20d_vs_prev120d": "1.68721474",
      "max_daily_move_21d": "0.34776340",
      "max_daily_move_date_21d": "2026-08-10",
      "max_daily_move_signed_21d": "0.34776340",
      "max_1d_share_of_abs_move_21d": "0.26832042",
      "directional_efficiency_21d": "0.71209703",
      "post_max_move_return_5d": "0.19914343",
      "post_max_move_return_10d": "0.13597425",
      "max_gap_21d": "0.26406933",
      "distance_from_52w_high": "0.00000000",
      "distance_from_52w_low": "3.49640292",
      "trigger_conditions": "spy_relative;sector_relative;volatility;single_day_move;gap",
      "trigger_count": "5",
      "selection_reason": "threshold_and_sector_coverage",
      "signal_score": "43.02590000",
      "first_trigger_date": "2026-07-28",
      "trigger_days_last_5": "5",
      "trigger_days_last_10": "10",
      "consecutive_trigger_days": "12",
      "rank_previous": "6.00000000",
      "rank_change": "3.00000000",
      "new_entry": "True",
      "persistent_signal": "True",
      "entity_id": "ent_7b3775c2e10cd8e482948eb6ddb2655dc93c559bfd4841c0788ce795b400bf3a",
      "route_candidate_id": "route_9dd1098cf8af26df275dcbfd75934d8293e0436bf99d8783456ae7d3da881c4a",
      "source_dataset": "event_anomaly",
      "original_rank": 3,
      "entry_price_status": "pending",
      "entry_price": null,
      "first_tradable_at": "2026-08-26T13:30:00+00:00",
      "entry_price_timestamp": null,
      "entry_price_type": "next_session_open",
      "timezone": "America/New_York",
      "quantitative_processing_status": "processed",
      "treatment": "web_research",
      "treatment_reason": "deterministic cross-route research selection",
      "data_quality_status": "passed"
    },
    {
      "rank": "4",
      "ticker": "AMLX",
      "company_name": "Amylyx Pharmaceuticals, Inc.",
      "sector": "Healthcare",
      "industry": "",
      "exchange": "NMS",
      "market_cap": "4173907200.00000000",
      "market_data_date": "2026-08-25",
      "price": "37.45999908",
      "return_1d": "-0.01808656",
      "return_5d": "0.06693245",
      "return_21d": "0.92201126",
      "return_63d": "1.73830397",
      "return_126d": "1.54656689",
      "spy_return_63d": "0.02041054",
      "spy_return_126d": "0.11429403",
      "spy_relative_21d": "0.88572347",
      "spy_relative_63d": "1.71789343",
      "spy_relative_126d": "1.43227286",
      "sector_etf": "XLV",
      "sector_etf_return_21d": "0.07276622",
      "sector_etf_return_63d": "0.18032456",
      "sector_etf_return_126d": "0.11034395",
      "sector_relative_21d": "0.84924505",
      "sector_relative_63d": "1.55797941",
      "sector_relative_126d": "1.43622295",
      "volume_ratio_5d_vs_prev20d": "1.76551924",
      "avg_dollar_volume_20d": "125568064.80073090",
      "volatility_ratio_20d_vs_prev120d": "4.14624342",
      "max_daily_move_21d": "0.63835745",
      "max_daily_move_date_21d": "2026-08-18",
      "max_daily_move_signed_21d": "0.63835745",
      "max_1d_share_of_abs_move_21d": "0.48811259",
      "directional_efficiency_21d": "0.56751561",
      "post_max_move_return_5d": "0.06693245",
      "post_max_move_return_10d": "",
      "max_gap_21d": "0.39570693",
      "distance_from_52w_high": "-0.05547153",
      "distance_from_52w_low": "3.08951962",